code,name,material,slot,slot_index,effect_text,source
KMM,Кровь Мертвого Мага/Кровь Гуля/Кровь Драуга,Клубничный сок с черным красителем или активированным углем,add3,3,Используется в эликсирах для разжигания неудачи (см правила по маркерам),Copy of Лаборатория Агнес.xlsx
KPM,Камень из почки мага,Мятный леденец,main,0,"Увеличивает силу крови мага (на время действия эликсира/зелья) на силу эликсира, на 1 боевую ситуацию.",Copy of Лаборатория Агнес.xlsx
KPM,Камень из почки мага,Мятный леденец,add1,1,Позволяет увеличить контроль магии (сила любых магических техник *2),Copy of Лаборатория Агнес.xlsx
KPM,Камень из почки мага,Мятный леденец,add2,2,Дарует физическое здоровье (используется в зельях/эликсирах лечения физ ран),Copy of Лаборатория Агнес.xlsx
KPM,Камень из почки мага,Мятный леденец,add3,3,Сильное противоядие,Copy of Лаборатория Агнес.xlsx
KQ,Квинтэсэнция (Душа/Красный),Соляной раствор (концентрат),main,0,"Дает прозрение (одноразовая сработка таланта ""Третий Глаз"" на 1 ступени)",Copy of Лаборатория Агнес.xlsx
KQ,Квинтэсэнция (Душа/Красный),Соляной раствор (концентрат),add1,1,Уравновешенность,Copy of Лаборатория Агнес.xlsx
KQ,Квинтэсэнция (Душа/Красный),Соляной раствор (концентрат),add2,2,Лечение магических болезней (ментальных),Copy of Лаборатория Агнес.xlsx
KQ,Квинтэсэнция (Душа/Красный),Соляной раствор (концентрат),add3,3,Способно лечить физические раны (восстанавливает хиты),Copy of Лаборатория Агнес.xlsx
KS,Кровь Сильфа,Голубой пищевой краситель,main,0,Увеличивает Легкомыслие,10.2 Алхимия_ Молодой Аристократ.xlsx
KS,Кровь Сильфа,Голубой пищевой краситель,add1,1,Обладает свойствами невидимости (красная вуаль),10.2 Алхимия_ Молодой Аристократ.xlsx
KS,Кровь Сильфа,Голубой пищевой краситель,add2,2,"Отрезвляет, без похмелья",10.2 Алхимия_ Молодой Аристократ.xlsx
KS,Кровь Сильфа,Голубой пищевой краситель,add3,3,Используется для зелий Левитации,10.2 Алхимия_ Молодой Аристократ.xlsx
KSH,Когти Велесов Зверя/Чесма-Иеси/Шейско-хорского кота,Кедровые Орехи,main,0,"Используется для очищения от мутаций, а так же может использоваться в элексирах лечения физических ран (востановления хитов)",Copy of Лаборатория Агнес.xlsx
KSH,Когти Велесов Зверя/Чесма-Иеси/Шейско-хорского кота,Кедровые Орехи,add1,1,Вызывает галюцинации,Copy of Лаборатория Агнес.xlsx
KSH,Когти Велесов Зверя/Чесма-Иеси/Шейско-хорского кота,Кедровые Орехи,add2,2,Дарует магические силы (талант или магический плюс рандомно от МГ),Copy of Лаборатория Агнес.xlsx
KSH,Когти Велесов Зверя/Чесма-Иеси/Шейско-хорского кота,Кедровые Орехи,add3,3,"Натягивает связь тела и личности, деляя ее более короткой",Copy of Лаборатория Агнес.xlsx
KSI,Крылья Сильфа,Молочный шоколад,main,0,Используется в эликсирах Полета,Copy of Лаборатория Агнес.xlsx
KSI,Крылья Сильфа,Молочный шоколад,add1,1,"Может использоваться в эликсирах смены предрасположености (только по средством мутации). При использовании в зельях предрасположеность меняется временно, пока работает зелье (бросьте куб d10 и через бот сообщите мг значение, для того что бы вам сообщили вашу временную предрасположеность)",Copy of Лаборатория Агнес.xlsx
KSI,Крылья Сильфа,Молочный шоколад,add2,2,"Получение минуса ""Любопытная Варвара"" (только по средством мутации). При использовании в зельях минус появляется временно, пока работает зелье.",Copy of Лаборатория Агнес.xlsx
KSI,Крылья Сильфа,Молочный шоколад,add3,3,Для эликсиров/зелий проникновения в чужой сон,Copy of Лаборатория Агнес.xlsx
KVI,Крыло взрослого импла,Лавровый лист,main,0,"Позволяет использовать талант ""улыбка Хитреца"" 1 ступени",Copy of Лаборатория Агнес.xlsx
KVI,Крыло взрослого импла,Лавровый лист,add1,1,"Слабость к музыке: доверие как к близкому другу к любому, кто является источником музыки (поет, играет, включил музыку)",Copy of Лаборатория Агнес.xlsx
KVI,Крыло взрослого импла,Лавровый лист,add2,2,Клептомания,Copy of Лаборатория Агнес.xlsx
KVI,Крыло взрослого импла,Лавровый лист,add3,3,Повышенная мстительность,Copy of Лаборатория Агнес.xlsx
KZD,Кровь золотого дракона,Золотой пищевой краситель,main,0,Магия темпуса на выходе сила*2,Copy of Лаборатория Агнес.xlsx
KZD,Кровь золотого дракона,Золотой пищевой краситель,add1,1,Возврат в нормальное состояние тела и разума для типа существа и чистоты крови,Copy of Лаборатория Агнес.xlsx
KZD,Кровь золотого дракона,Золотой пищевой краситель,add2,2,Покрытие золотой чешуей (физ. щит силой вашего эликсира/зелья),Copy of Лаборатория Агнес.xlsx
KZD,Кровь золотого дракона,Золотой пищевой краситель,add3,3,Позволяет увеличить безопасно время нахождения в стазисе/коме время увеличивается на ступень*10 минут,Copy of Лаборатория Агнес.xlsx
LG,Луговой клевер,Зеленый чай,main,0,"Слабый яд, для змееподобных существ (драконы, различные змеи, полукровки от них и т.д.)",Copy of Лаборатория Агнес.xlsx
LG,Луговой клевер,Зеленый чай,add1,1,Призывает удачу (маркер золотых звезд),Copy of Лаборатория Агнес.xlsx
LG,Луговой клевер,Зеленый чай,add2,2,"Вызывает заболевание ""Дырявая Душа"" (получить аскольд карту у МГ)",Copy of Лаборатория Агнес.xlsx
LG,Луговой клевер,Зеленый чай,add3,3,"Позволяет выйти в мир снов Настоящее, как после применения соответсвующих заклинаний сноходства",Copy of Лаборатория Агнес.xlsx
LH,Лиллея Шерстистая,Лаванда,main,0,Повышает настроение до здоровой веселости,Copy of Лаборатория Агнес.xlsx
LH,Лиллея Шерстистая,Лаванда,add1,1,Лечит нарушения сна,Copy of Лаборатория Агнес.xlsx
LH,Лиллея Шерстистая,Лаванда,add2,2,Понижает половое влечение,Copy of Лаборатория Агнес.xlsx
LH,Лиллея Шерстистая,Лаванда,add3,3,Спасает от кошмаров,Copy of Лаборатория Агнес.xlsx
MA,Марена Аравийская,Пуэр,main,0,Невозможно уснуть,10.2 Алхимия_ Молодой Аристократ.xlsx
MA,Марена Аравийская,Пуэр,add1,1,"Бодрость (способность находиться в состоянии высокого жизненного тонуса, избытка сил и желания что-либо делать)",10.2 Алхимия_ Молодой Аристократ.xlsx
MA,Марена Аравийская,Пуэр,add2,2,Бесстрашие и безрассудство,10.2 Алхимия_ Молодой Аристократ.xlsx
MA,Марена Аравийская,Пуэр,add3,3,Вспыльчивость,10.2 Алхимия_ Молодой Аристократ.xlsx
MER,Медный Реликт (Мир/Голубой),Тростниковый сахар кубиком,main,0,Помогает при разного рода омоложении сознания,10.2 Алхимия_ Молодой Аристократ.xlsx
MER,Медный Реликт (Мир/Голубой),Тростниковый сахар кубиком,add1,1,Помогает при дезориентации в пространстве,10.2 Алхимия_ Молодой Аристократ.xlsx
MER,Медный Реликт (Мир/Голубой),Тростниковый сахар кубиком,add2,2,Головная боль в височной части,10.2 Алхимия_ Молодой Аристократ.xlsx
MER,Медный Реликт (Мир/Голубой),Тростниковый сахар кубиком,add3,3,Снимает дрожжь в конечностях,10.2 Алхимия_ Молодой Аристократ.xlsx
MG,Марчиликант Глубинный,Базилик Зелёный,main,0,Успокаивает до безэмоциональности,Copy of Лаборатория Агнес.xlsx
MG,Марчиликант Глубинный,Базилик Зелёный,add1,1,Очищает разум,Copy of Лаборатория Агнес.xlsx
MG,Марчиликант Глубинный,Базилик Зелёный,add2,2,Восстанавливает память,Copy of Лаборатория Агнес.xlsx
MG,Марчиликант Глубинный,Базилик Зелёный,add3,3,Снотворное,Copy of Лаборатория Агнес.xlsx
MHK,Можжевельник кладбищенский,Можжевельник,main,0,"В составе эликсира дает магу защиту от различных духов и призраков, защищая от проникновения их в тело.",Copy of Лаборатория Агнес.xlsx
MHK,Можжевельник кладбищенский,Можжевельник,add1,1,Улучшает ментальную защиту,Copy of Лаборатория Агнес.xlsx
MHK,Можжевельник кладбищенский,Можжевельник,add2,2,Усиливает любой эликсир/зелье на выходе. Сила усиления зависит от ступени приготовления зелья/эликсира. Усиление идет +показатель ступени.,Copy of Лаборатория Агнес.xlsx
MHK,Можжевельник кладбищенский,Можжевельник,add3,3,Против проклятий (временно их отключает если сила зелья/эликсира выше его показателя силы),Copy of Лаборатория Агнес.xlsx
MIV,Молоко Вилтака,Кокосовое Молоко,main,0,"Затягивает легкие раны, кол-во которых напрямую зависит от силы зелья/эликсира (работает, как плюс ""Регенерация"")",10.2 Алхимия_ Молодой Аристократ.xlsx
MIV,Молоко Вилтака,Кокосовое Молоко,add1,1,Проявляет невидимое,10.2 Алхимия_ Молодой Аристократ.xlsx
MIV,Молоко Вилтака,Кокосовое Молоко,add2,2,Понижает Голод (позволяет заглушить голод персонажа фруктами или овощами),10.2 Алхимия_ Молодой Аристократ.xlsx
MIV,Молоко Вилтака,Кокосовое Молоко,add3,3,Снижает агресивность,10.2 Алхимия_ Молодой Аристократ.xlsx
MMM,Мясо Маркополо,Вареная колбаса/сосиски,main,0,"Вызывает общее насыщение организма, используется в мутациях для получения плюса ""Сытый""",10.2 Алхимия_ Молодой Аристократ.xlsx
MMM,Мясо Маркополо,Вареная колбаса/сосиски,add1,1,Дает неуязвимость к стихийной магии и энергии Души,10.2 Алхимия_ Молодой Аристократ.xlsx
MMM,Мясо Маркополо,Вареная колбаса/сосиски,add2,2,Может использоваться против плюсов физического или магического типа,10.2 Алхимия_ Молодой Аристократ.xlsx
MMM,Мясо Маркополо,Вареная колбаса/сосиски,add3,3,Может использоваться против плюсов психических и существ,10.2 Алхимия_ Молодой Аристократ.xlsx
MR,Миртилия Равнинная,Листья Ежевики,main,0,"Вызывает галюцинации, может использоваться для выхода в транс для Шаманов или для глубокого погружения в медитацию.",10.2 Алхимия_ Молодой Аристократ.xlsx
MR,Миртилия Равнинная,Листья Ежевики,add1,1,"Состояние влюбленности (в первое существо (разумное) противоположного пола, которое увидел)",10.2 Алхимия_ Молодой Аристократ.xlsx
MR,Миртилия Равнинная,Листья Ежевики,add2,2,Фрагментарное ухудшение памяти,10.2 Алхимия_ Молодой Аристократ.xlsx
MR,Миртилия Равнинная,Листья Ежевики,add3,3,Заставляет говорить только правду,10.2 Алхимия_ Молодой Аристократ.xlsx
MС,Молодильный Семень,Душистый Перец Горошком,main,0,"Омолаживает на 10 лет, может применяться 1 раз на 1 персонажа за всю его жизнь",10.2 Алхимия_ Молодой Аристократ.xlsx
MС,Молодильный Семень,Душистый Перец Горошком,add1,1,Уменьшает влечение к противоположному полу,10.2 Алхимия_ Молодой Аристократ.xlsx
MС,Молодильный Семень,Душистый Перец Горошком,add2,2,"Защищает от суккубов и инкубов (любых видов соблазнения, убирает воздействия афродизиаков и приворотов)",10.2 Алхимия_ Молодой Аристократ.xlsx
MС,Молодильный Семень,Душистый Перец Горошком,add3,3,Заставляет непрерывно врать,10.2 Алхимия_ Молодой Аристократ.xlsx
OM,Омела,Иван Чай,main,0,Средний Яд (открывает кровотечение),Copy of Лаборатория Агнес.xlsx
OM,Омела,Иван Чай,add1,1,Бесстрашие и безрассудство,Copy of Лаборатория Агнес.xlsx
OM,Омела,Иван Чай,add2,2,"Выводит из депрессии, повышает общий тонус организма, бодрит",Copy of Лаборатория Агнес.xlsx
OM,Омела,Иван Чай,add3,3,Заставляет фиксироваться на одной цели,Copy of Лаборатория Агнес.xlsx
PL,Платиум (Свет/Желтый),Белый сахар кубиком,main,0,"Обращает вспять превращения любого рода (отменяет последнюю мутацию организма, останавливает превращение через блокировку таланта ""Превращение"" и блокировку плюса ""Второй Облик"")",10.2 Алхимия_ Молодой Аристократ.xlsx
PL,Платиум (Свет/Желтый),Белый сахар кубиком,add1,1,Возвращает утерянный слух,10.2 Алхимия_ Молодой Аристократ.xlsx
PL,Платиум (Свет/Желтый),Белый сахар кубиком,add2,2,Возвращает утерянное зрение,10.2 Алхимия_ Молодой Аристократ.xlsx
PL,Платиум (Свет/Желтый),Белый сахар кубиком,add3,3,"Приводит настроение в состояние равновесия, убирает негативные чувтсва",10.2 Алхимия_ Молодой Аристократ.xlsx
PS,Сушеные пальцы Скоге/Ауки,Укроп,main,0,"Мстительность, агрессия",Copy of Лаборатория Агнес.xlsx
PS,Сушеные пальцы Скоге/Ауки,Укроп,add1,1,Дают возможность разговаривать с растениями,Copy of Лаборатория Агнес.xlsx
PS,Сушеные пальцы Скоге/Ауки,Укроп,add2,2,Защищают от воздействий на разум,Copy of Лаборатория Агнес.xlsx
PS,Сушеные пальцы Скоге/Ауки,Укроп,add3,3,Сводят с ума,Copy of Лаборатория Агнес.xlsx
QCH,Калёное Железо (Тело/Синий),Паприка молотая,main,0,Приводит в баланс энергии Жизни и Смерти в теле  (выравнивает кол-во карт Жизни и Смерти в теле Лекаря в меньшую сторону),Copy of Лаборатория Агнес.xlsx
QCH,Калёное Железо (Тело/Синий),Паприка молотая,add1,1,Нормализует энергообмен в теле,Copy of Лаборатория Агнес.xlsx
QCH,Калёное Железо (Тело/Синий),Паприка молотая,add2,2,Возвращает телу чувствительность,Copy of Лаборатория Агнес.xlsx
QCH,Калёное Железо (Тело/Синий),Паприка молотая,add3,3,Наносит повреждения магическим созданиям (работает как слабый яд для существ),Copy of Лаборатория Агнес.xlsx
QLH,Череп Лиха/Череп Трау,Горчичный порошок,main,0,"Позволяет взять под контроль любого мага по аналогии с талантом ""Знаменитый Кукловод"" на 2 ступени реализации (если использовать с кровью жертвы)",Copy of Лаборатория Агнес.xlsx
QLH,Череп Лиха/Череп Трау,Горчичный порошок,add1,1,"Усиливает техники энергии если в составе эликисра используется металл, определение усиления идет в зависимотри от металла  (сила эликсира/2 = + к техникам)",Copy of Лаборатория Агнес.xlsx
QLH,Череп Лиха/Череп Трау,Горчичный порошок,add2,2,"Дарует талант ""Манипулятор"" на 1 ступени реализации",Copy of Лаборатория Агнес.xlsx
QLH,Череп Лиха/Череп Трау,Горчичный порошок,add3,3,"Разжигает голод на 1 ступени, до плоти магов",Copy of Лаборатория Агнес.xlsx
RCH,Речница,Календула,main,0,"Повышает привлекательность в глазах представителей противоположного пола, может использоваться в приворотных эликсирах.",Copy of Лаборатория Агнес.xlsx
RCH,Речница,Календула,add1,1,Уменьшает силу стихийных чар,Copy of Лаборатория Агнес.xlsx
RCH,Речница,Календула,add2,2,Побуждает рисковать и подбивать на рискованные действия других,Copy of Лаборатория Агнес.xlsx
RCH,Речница,Календула,add3,3,"Усиливает техники энергии ""Мира"" (сила эликсира/2 = + к техникам)",Copy of Лаборатория Агнес.xlsx
RK,Рогатый Корень,Корень имбиря,main,0,Тонизирует (более слабый вариант бодрости),Copy of Лаборатория Агнес.xlsx
RK,Рогатый Корень,Корень имбиря,add1,1,"Способно спасти от смертельных ядов, противоядие",Copy of Лаборатория Агнес.xlsx
RK,Рогатый Корень,Корень имбиря,add2,2,Исцеляет физические раны,Copy of Лаборатория Агнес.xlsx
RK,Рогатый Корень,Корень имбиря,add3,3,Увеличивает самую сильную привязанность до влюбленности,Copy of Лаборатория Агнес.xlsx
ROS,Рога Суккуба/Рога Трау,темный шоколад,main,0,Дает возможность на 3 часа быть неотразимым кому угодно (ношение красной розы),Copy of Лаборатория Агнес.xlsx
ROS,Рога Суккуба/Рога Трау,темный шоколад,add1,1,Вызывает сексуальную дисфункцию (спосает от любых приворотов),Copy of Лаборатория Агнес.xlsx
ROS,Рога Суккуба/Рога Трау,темный шоколад,add2,2,"Вызывает сексуальный подьем (работает как сильный стимулятор, раскрывает сексуальное влечение и выпускает на ружу)",Copy of Лаборатория Агнес.xlsx
ROS,Рога Суккуба/Рога Трау,темный шоколад,add3,3,Слабый яд,Copy of Лаборатория Агнес.xlsx
RP,Роза Памяти,Плоды шиповника,main,0,"Делает неуязвимым к воздействиям на память, восстанавливает память. Защита ментальной составляющей Разум.",Copy of Лаборатория Агнес.xlsx
RP,Роза Памяти,Плоды шиповника,add1,1,"Неконтролируемая сработка таланта ""Истинный Сноходец"" 1 ступени, тоесть выход в мир снов ""Настоящее"" вместе с телом",Copy of Лаборатория Агнес.xlsx
RP,Роза Памяти,Плоды шиповника,add2,2,Привлекает духов,Copy of Лаборатория Агнес.xlsx
RP,Роза Памяти,Плоды шиповника,add3,3,Усиливает техники ментальной магии (сила эликсира/2 =  + к техникам),Copy of Лаборатория Агнес.xlsx
